constraint_id,target,chain,position,position_pair,constraint_type,evidence_level,evidence_source,source_antigen,source_pH_definition,endpoint_type,endpoint_condition,allowed_usage,applies_to_AeS_window_selection,applies_to_library_design,rationale,source_note
1e62_L41_hard_protect,1E62,L,41.0,,hard_protect,confirmed,manual_project_prior,AeS,mixed_project_prior,manual_constraint,construct_integrity,hard_filter,True,True,1E62 light-chain L41/W41 is a strong protection site.,Manual prior from project review.
1e62_H35_H37_HHH_soft_risk,1E62,H,,H35-H37,soft_risk,probable,manual_project_prior,AeS,mixed_project_prior,manual_constraint,HHH_cluster,risk_label,True,True,1E62 H35-H37 HHH cluster should be treated as a risk/mechanism tag.,Manual prior from project review.
sdab_F37_hard_protect,sdAb,A,37.0,,hard_protect,confirmed,manual_project_prior,AeS,mixed_project_prior,manual_constraint,framework_integrity,hard_filter,True,True,sdAb FR2/FR3 framework site should be protected.,Manual prior from project review.
sdab_F47_A49_G50_hard_protect,sdAb,A,,A47-A49-A50,hard_protect,confirmed,manual_project_prior,AeS,mixed_project_prior,manual_constraint,framework_integrity,hard_filter,True,True,sdAb F47/A49/G50 framework positions should be protected.,Manual prior from project review.
sdab_V105H_D110H_negative_pair,sdAb,A,,A105H-A110H,negative_pair,probable,manual_project_prior,AeS,mixed_project_prior,manual_constraint,pH7_neutral_binding_risk,risk_label,True,True,V105H-D110H combination has neutral-binding collapse risk.,Manual prior from project review.
